{
  "schema_version": "1.0.0",
  "data_status": "synthetic",
  "generated_at": "2026-08-07T12:00:00Z",
  "document_id": "doc:18216-05",
  "evidence": [
    {
      "id": "ev:1",
      "source_ref": {
        "id": "doc:18216-05",
        "title": "Articulado del proyecto — artículo 3°",
        "url": "https://www.dipres.gob.cl/604/articles-409825_doc_pdf.pdf",
        "publisher": null,
        "published_at": "2026-05-12",
        "tier": "primary_document",
        "independence": "original_reporting",
        "language": "es-CL"
      },
      "tier": "primary_document",
      "statement": "El artículo 3° del articulado establece una sobretasa de dos puntos porcentuales para contribuyentes con ingresos brutos anuales sobre 100.000 UF, por los años tributarios 2027 a 2031.",
      "spans": [
        {
          "page": 3,
          "section_id": "sec:2.1",
          "char_start": 1880,
          "char_end": 1978,
          "text": "una sobretasa de dos puntos porcentuales sobre la base imponible del impuesto de primera categoría"
        }
      ],
      "retrieved_at": "2026-08-07T09:00:00Z",
      "supports": [
        "clm:3"
      ],
      "contradicts": [],
      "evidential_relevance": {
        "question": "¿Qué tasa y qué umbral fija el texto para la sobretasa?",
        "relevance": 0.98,
        "can_establish": [
          "que el texto fija una sobretasa de 2 puntos porcentuales",
          "que el umbral de aplicación son 100.000 UF de ingresos brutos anuales"
        ],
        "cannot_establish": [
          "que la sobretasa recaudará el monto proyectado",
          "que la sobretasa se mantendrá tras 2031"
        ],
        "why": "El texto operativo es decisivo sobre lo que la norma dice y no dice nada sobre sus efectos."
      },
      "strength": "high",
      "independence": "original_reporting",
      "derived_from_evidence_id": null,
      "quantities": [
        {
          "value": 2.0,
          "kind": "percentage_point",
          "unit": "pp",
          "raw_text": "dos puntos porcentuales"
        }
      ],
      "money": [],
      "confidence": {
        "evidence_confidence": 0.9,
        "model_confidence": 0.74,
        "basis": [
          {
            "factor": "primary_source_coverage",
            "effect": "raises",
            "note": "Pasaje citado del texto operativo."
          },
          {
            "factor": "source_independence",
            "effect": "neutral",
            "note": "Ítem original, no una reproducción de otro."
          }
        ],
        "limiting_factor": "Todo el conjunto es sintético: ninguna fuente real fue consultada."
      },
      "uncertainties": [
        {
          "statement": "El ítem pertenece a un conjunto sintético y no corresponde a ninguna fuente real.",
          "kind": "out_of_scope",
          "resolvable_by": "Ejecutar la recuperación en línea sobre el registro de fuentes real."
        }
      ],
      "extraction_method": "aleph-fixture/0.1.0",
      "notes": null
    },
    {
      "id": "ev:2",
      "source_ref": {
        "id": "doc:18216-05",
        "title": "Articulado del proyecto — artículo 6°",
        "url": "https://www.dipres.gob.cl/604/articles-409825_doc_pdf.pdf",
        "publisher": null,
        "published_at": "2026-05-12",
        "tier": "primary_document",
        "independence": "original_reporting",
        "language": "es-CL"
      },
      "tier": "primary_document",
      "statement": "El artículo 6° crea un aporte mensual de $42.000 por hogar para los cuatro primeros deciles, pagadero durante veinticuatro meses.",
      "spans": [
        {
          "page": 5,
          "section_id": "sec:3.1",
          "char_start": 450,
          "char_end": 507,
          "text": "un aporte mensual de estabilización, de $42.000 por hogar"
        }
      ],
      "retrieved_at": "2026-08-07T09:00:00Z",
      "supports": [
        "clm:4"
      ],
      "contradicts": [],
      "evidential_relevance": {
        "question": "¿Qué monto y qué duración fija el texto para la transferencia a hogares?",
        "relevance": 0.97,
        "can_establish": [
          "que el monto mensual por hogar es $42.000",
          "que el pago dura veinticuatro meses"
        ],
        "cannot_establish": [
          "que todos los hogares elegibles lo recibirán",
          "que el aporte compensará el efecto de otras medidas"
        ],
        "why": "Establece el contenido de la norma; la incidencia efectiva es otra cuestión."
      },
      "strength": "high",
      "independence": "original_reporting",
      "derived_from_evidence_id": null,
      "quantities": [
        {
          "value": 24.0,
          "kind": "duration",
          "unit": "meses",
          "raw_text": "veinticuatro meses"
        }
      ],
      "money": [
        {
          "amount": 42000.0,
          "currency": "CLP",
          "unit": "unit",
          "year": 2026,
          "basis": "monthly"
        }
      ],
      "confidence": {
        "evidence_confidence": 0.9,
        "model_confidence": 0.74,
        "basis": [
          {
            "factor": "primary_source_coverage",
            "effect": "raises",
            "note": "Pasaje citado del texto operativo."
          },
          {
            "factor": "source_independence",
            "effect": "neutral",
            "note": "Ítem original, no una reproducción de otro."
          }
        ],
        "limiting_factor": "Todo el conjunto es sintético: ninguna fuente real fue consultada."
      },
      "uncertainties": [
        {
          "statement": "El ítem pertenece a un conjunto sintético y no corresponde a ninguna fuente real.",
          "kind": "out_of_scope",
          "resolvable_by": "Ejecutar la recuperación en línea sobre el registro de fuentes real."
        }
      ],
      "extraction_method": "aleph-fixture/0.1.0",
      "notes": null
    },
    {
      "id": "ev:3",
      "source_ref": {
        "id": "doc:18216-05",
        "title": "Articulado del proyecto — artículo 7°",
        "url": "https://www.dipres.gob.cl/604/articles-409825_doc_pdf.pdf",
        "publisher": null,
        "published_at": "2026-05-12",
        "tier": "primary_document",
        "independence": "original_reporting",
        "language": "es-CL"
      },
      "tier": "primary_document",
      "statement": "El artículo 7° dota el Fondo de Estabilización Territorial con recursos anuales equivalentes al 0,18% del producto interno bruto.",
      "spans": [
        {
          "page": 6,
          "section_id": "sec:3.2",
          "char_start": 420,
          "char_end": 502,
          "text": "se dotará anualmente con recursos equivalentes al 0,18% del producto interno bruto"
        }
      ],
      "retrieved_at": "2026-08-07T09:00:00Z",
      "supports": [
        "clm:2"
      ],
      "contradicts": [],
      "evidential_relevance": {
        "question": "¿Qué dotación anual fija el texto para el fondo municipal?",
        "relevance": 0.96,
        "can_establish": [
          "que la dotación anual es 0,18% del PIB",
          "que la fórmula pondera población, ingresos propios por habitante y ruralidad"
        ],
        "cannot_establish": [
          "que los recursos se transferirán efectivamente en 2027",
          "qué recibirá cada municipio en particular"
        ],
        "why": "Fija la magnitud de la dotación; nada dice sobre el calendario de ejecución."
      },
      "strength": "high",
      "independence": "original_reporting",
      "derived_from_evidence_id": null,
      "quantities": [
        {
          "value": 0.18,
          "kind": "percentage",
          "unit": "% del PIB",
          "raw_text": "0,18% del producto interno bruto"
        }
      ],
      "money": [
        {
          "amount": 0.18,
          "currency": "CLP",
          "unit": "percent_of_gdp",
          "year": 2027,
          "basis": "annual"
        }
      ],
      "confidence": {
        "evidence_confidence": 0.9,
        "model_confidence": 0.74,
        "basis": [
          {
            "factor": "primary_source_coverage",
            "effect": "raises",
            "note": "Pasaje citado del texto operativo."
          },
          {
            "factor": "source_independence",
            "effect": "neutral",
            "note": "Ítem original, no una reproducción de otro."
          }
        ],
        "limiting_factor": "Todo el conjunto es sintético: ninguna fuente real fue consultada."
      },
      "uncertainties": [
        {
          "statement": "El ítem pertenece a un conjunto sintético y no corresponde a ninguna fuente real.",
          "kind": "out_of_scope",
          "resolvable_by": "Ejecutar la recuperación en línea sobre el registro de fuentes real."
        }
      ],
      "extraction_method": "aleph-fixture/0.1.0",
      "notes": null
    },
    {
      "id": "ev:4",
      "source_ref": {
        "id": "doc:18216-05",
        "title": "Articulado del proyecto — artículo primero transitorio",
        "url": "https://www.dipres.gob.cl/604/articles-409825_doc_pdf.pdf",
        "publisher": null,
        "published_at": "2026-05-12",
        "tier": "primary_document",
        "independence": "original_reporting",
        "language": "es-CL"
      },
      "tier": "primary_document",
      "statement": "El artículo primero transitorio entrega a un reglamento, a dictarse dentro de 180 días desde la publicación, la fórmula de distribución del Fondo.",
      "spans": [
        {
          "page": 9,
          "section_id": "sec:4.4",
          "char_start": 1540,
          "char_end": 1636,
          "text": "Un reglamento, dictado dentro de los ciento ochenta días siguientes a la publicación de esta ley"
        }
      ],
      "retrieved_at": "2026-08-07T09:00:00Z",
      "supports": [
        "clm:14"
      ],
      "contradicts": [
        "clm:13"
      ],
      "evidential_relevance": {